[
  {
    "tc_id": "1",
    "description": "NIST ACVP ts=763867 vsId=4022388 sigGen tcId=1",
    "seed_keygen_hex": "0x000000000000000000000000000000000000000000000000000000000000000000000000000000000000000000000000000000000000000000000000000000000000000000000000000000000000000000000000000000000000000000000000",
    "msg_digest_hex": "0xf87407b4ca9807792d7c7bde90c949b540a85e1d0e0a398fbc8b3d540bcc4ad0",
    "expected_pk_hex": "0x405003761b48654f462b22fb1a5bd4e310ff4af18620ecdc9dbee34556f72f03",
    "expected_sig_hex": "0x64a0645152805e035d75929b5d69e9dc3ca6b5f01be17b8001ee7037d7d10ca960b2512dfb0da3f5423ae91ec4108db248ba1d323cf3a2edf722db6cf7c898daa30bae0aa45c17622186bc49c5154813052450d9c6c18d3821f123f8aa1ea8f961b9bd250632eef2aca7b91ef5983d0fa7a0d6efec7594b12bd1e6644c4ade027012c3e1f9498685e1c7f2d9ef7e052d07707eb048e2fe3e601cb71e05404435188ef39907fceb7cab71b3c63b9e150cbd6c430397422e4fb3e03e202da032f563114b179c2b2b1310dbb17263ca9f3d4c28ee0002fc0e91a40a73cf647b6e526beeb5b51c7b36eeb2a1f14a4c6736c282e5ad5a1f8a2176d3e65b097aa822fb15e0c07572d8b168f24899317cf32a68e99450bec56d2800dff88c594db2feea273b04b0d9085ba6549cf215d2eddfca0498a4c9f747e0f824853261cdc230d855713ab2bf502ace7132bf2fb9748440fe4610ef18c27eae34c7fc91c9ed5092638e14a49146b132450c1395d8371e8db9a836a0ef2aeba0d78f53cd197be2410fc6da539fc268daa222074e7fb5782aa892f950f7a4e6a6a0a50ad660ca8e861fd847622c91413e8b1c6960b11225ba728e011c544f4337df8d068d664bbef2fc75ad229f2f8b1533b51cfdcfd10042ad5791221ab67d3f30d2032099484b33e337a264c419837380d528f04c7cef9cc1440c2cd06f9f471a6cb0822ac774ef6355509328080bdf121ce7d6a71d83f61633323e49d3b56ee544f683456b3c766fce9c4e833befe766fe479abe0ada8fa9d03d58e8e0deb5b223c03b958f7efeb7d5f0560ed534b0d949e8ea6b56395060ff6f4628861b202f0455db62a6cbf285964b2f43c26257715c2895c320cd5e35223f2590bce642a9e576c89f13d62f324260958a74874c31ae432490587daace99e78de80be7bcf847f4498aed7d8e0ea46db4196c2325492f2e2ee179a8ff3e11a8b841cc7cc6e98409deb6873cd71e1b21db127aa39159ddfb3d22fcd991ac7ec56446226f248ac04332f06a3bd1251b7408fbedfbc12548248d84f884c2946485b151c068e0b0c1959cc355d9b578bd890e9c32d1555f3bfd3198192e77b641fc7bbc979262ceb8d90951e92e93910ef6544358fd1af2d4eb6a02c0b6b13e786803c459a16d6a11d79d12c8b4364bbfda01beee0d083584adbd78a55d060a286acc48224a825d1a566c25aeb2d8a6c12e83461b63c5753038a3435896c35684d93761a071189c64824c75c7190ee041249340e98ffd0e7ce6b2b393dfb0184b4dee5e8d00b35e667ef33799239d38142d159caebd436086c3611edf8b5ff7993bc9b45d4cc232e4e009233fbcf7c4ac709c96aab9758fb7e0dcb75a03d974d763ca247c676b5beeb225bde25c55b6be264c961bfdd1bbc2a286dd66952d03c62811bf8650b34d27c54eadece5ed1f9bc4bce5b6d11f5959b366dafb83c7d91b592fba93e9e17b115cae96011a8975e315274ac68d96b7188a72fd53ec7ebccd3d6b2bdc94b75b68c6bdc928448e29c57c7548f37612a119c3ff5c5c551c64b1fdee5c459fad4fe667cac6432f05e230d815b37cf9c4ca196cc7205f3a6cceb6eafddb64f100ff0edc0b3ce8e7ec96640fcbee0a08b897dc0e2d166c67e824cd156adbeb116b7327c6b03afdc8befe6b683ebf9456b94541dfd3ee622bd592665b4867cfdb588f534df8d80c18d7736ad7bac6bbf7889fd4f11f55fe967a4409c0387ce737ce350a2ef1bfa7bd7ebd669d9461e604aa10b7eeaae60ec88b997d3e6c4326bf894fb6f5875d915105ac7d99db5679d073e1561a3dbf52eaeee8d3fa45268f5204541f3b884a12f8cd7399bbddc6752d9241b80cc563409beae26cee69dd455c599c07c581a733e36c4c52a446cdf7ff554f2ff52517014b5c58f6970d11bd1ac647f557aeeda59922adb6b9c4e4785301371e5ae2d1e31c7e8cf79afb5d3bb460f057ac2b2d2b6866f651678a26c7599194a91aadee8871ad8999632855d11af11006f95f913ce124aa1d139d2c1a9792cdcc875e0dd0b535437418c4b02bc4296298a11d6aa9f1f572dcb0508a135212261674a01b80db591238d7972a6eac1aabe2d38ddc973c38c618f7b0049503b00dcf6667ba4f4dc2bb435262ce1df99bc03200f85658acf6e6b9e22968b3f302c47de1c55baa32c01bae2d3e060cb70ec0de3713e776eb262b427fa799f497bfd0a0b555afc0e480d28d2720d72ca31427a2d2ab037eeb725b33bd8b2ead43a201c3c652921b9e9a08aac57275b91d9715303bc99fa789b247d66cc635bd92f44b52b1e6d3189b903a70a783f0243a6b75339b17dd7516f4e97b0fc0058f83aeb78b344991e741830d2e48af670b8bc9594eb3f6ec91bcf0654411e1227abcfa27a2d1a58d20f6191d29be5f5beecd0b3d193b9b2f1b9e6ba5691afae4b1fa1e32d428c44d722f8d19fdfbd8f8d2635226515e297b375d6f0f7066c4943f85a9427136b2429a0bdc9ecfa63a3abe015918e4aed1387688f0a86b464dc239afe77b6eccacff237b5563cc5ba86f7145e7e7c0841eefd902ff582bd7fa24ae1613282823782f4357f14bf4a571ec489ee2dd8c13077e0ad692fd88c5bd71b8d3031c2878b46a2cfff9df9a1653cb74ce635ecf9661e1192acb2b7e1191585fd61bd8fc79d77f7c3428cebeec675eccc4be7b85e1aba6ccc87d2a7a8623659930c31217572db2dc2613b8a5cf9425b1d0934d8536875e367f487f481a415d98baeff0da65b894f9a1be0307018a10e3d694c50b79804fcf91d66687684bd49116ee29e09dc13113462f7cdb9d564f4290e8f87f5ffd00f4b25aea16b33ffa54051a425154a92d0a6d93014d8e9f98a59dff70bf356bb8ad7116212d8964b5dc580fbc7fe5e05a985abdc709497eafc5cb4e526b11f1f69706c3422ca9e630e18ac4a1f500de1c63479a669a4e9247af012d8b90fdb4b15f73ae42f73a1894278a0578bee262f074a02ddb0ed81ceb9219ddcc0528b0120c7e623fb018414b30692eb005b20ee2f2575c2f92c9ee0ef8f8b73330b043e0fb81e7a1fe5c8355db29a4869919a1928b49c5d65f014288797067d855445b25ade31ba08c2071eea86fd17877aa858e4e269094bcdbd2fb99c3b1d3dc91c15d3abbea408a4a436f87136d6f5e4a85e222101e9712bdd6f1eb53ced71ae435c1ecdec71820c8e76ebacee6d082c9d60feb2f3a0d83fa1f683e150f03eed2efe3de9f3b5d255c2904a6c5a60a1edb97cfb3f4cb411ac5f2491e094315534b0450b9d0265a511b5ea25e4bf33b6f1b421647a20b5b603a23f8a0e08d5e9b61ada7e0bb927e23330b158c3e2f3dbbda0d895746358253cd9dca56642bd98c78a64dc1f890148090a1af9ccaffadfd0ff47a00f830300a37c3d9de1ca4a79b1a82b63cc2a08a9ed74889ce738529df6c563bafe4f7964db9b09e0bef9e235ae2b22cd6cda74a08ffd61fcd8c778e80979963f3524a4a026606faa8a6b9e6ff891cdfa2265b9008d8b0e00a49b47553573514d1f1f104c839358f0e6e54b7afb366c281a2ad283f7d8c26039361bde599c11e8dfb3ca6e2ca3aad22bc48714184c1fad4554541cd5719313daee8c5120a95365c7af6bd326d39129471cdd0e7ce6224245693da2cf0af409d0f3737366dc726a31d4033bbbf0a08524ae420ec25e0bce1ad96f30208e49c7a963e63cd1e120126bafbf6410ecac87f4948a6ad716e802bf76cbf8d95d416dacd27213862892a5058e70f9e4ee90ec629be4d28513192b090ec51ff1d2873939c1b74edc2391127b54254bb7fe3eb4907f861456b9f4cdf1abd303c7f2af6fd95a9281824721c85e6a310db43ff852a0b772f66c82497a12f682b2941f6c16106523fe99cc89f8894b88d39d3a0f1d80c0ba22f9f3fdf8501f1ef2e595f4a3abbdc71287c8bf9c4cb1ec4402bc4d002cb6b406fd1fb37b345767aea084fc71933450c6bf9967ff76cc3952019b6bf3813e96bb296e3f2b4a4d8796f3ea2f22599c5cac120319b1d58de8b5bda73ec61b2ce340c9d1981a6bef31f5a8d0ea8ee04570ccf3fc9a82b54299a3adf2f30b8c00800dfca3bbff77da00caaae06cfcb06f7ceef4beb8f97b50b746d46f5468a1264deb4ae3f207607cd27fe3ae50207664d597ef4d25a742882ad4c4007f364bb13b92616065500db9ff6f3e2c9130d487310b93dba49c64aee14440e6200bf400dfbdcf285c79d002fdb4a3cd3904388eb3866cae309b01abf8454b5927406996513dc7b02e7ed3623e7861b7a8c64660656d6f64b7ad1b3887a471db125d23fef31cb689ba024c0b17ef922be88f2b3df7a5e483cec52ae09c5cad1a2b98b79d8d5a4b07180309de241b14682d285d42e73148b492b8007c5e59c2f1b1a7aef154dda2433de701ed72f815edc42e5df2c13cab8262336b01e9c2726eb6a34c4b0c92a7ec33161fbe5eab13254f1344e55ae383c8f0361eb697ff89373b4a903cb18529e7c68e2f4afdbd56d5196b44235088e07bead874ca68f5cfcc4b0ba3b51337910b7838b1aeeaf4b4d154bc18eabd85f94ce3831cc64a63a96379942716977dc74dda25b807411376fc1bbdac0caf0d947e63f6cb8f2e6888dfef6f8ac3bbb085d87039b4ec9573ceb80d57b3547031a2b875c8bb16dd6a2d7d0dfea507fd2cebba6a4e9ece08450c8a8bb509b49e6e75b90446c7b3e915ca88a990826e162f9c762644e7d4048af0ebee5a2356826337a8b87a5a3659e8eed7cc1d9b978da0fcf115e9d2734d17473e70004c6f3f05b0a98e51a630d502ba9106aa3741afb7c97e20be644865fbd9bba4f5c71d669568ae568b77efbb98dbcf8ebadef6f62f68a49004e1b75cc34ad6a9064a6f893dabe34795ff49ae947661d45b1cd8dde217d3c5f5275e8b8bbb218b34b31f75a48d4fe634b19e09431621596775e31afd6a2a2b21a7dc150787cbd0ef00951d01861f376f6e9a9f0182784e26dd26442a620be9543abdab659df530b5309574d117ab17f638f505b283625ca757818e03a51f3df55dc6831462f8fe950630234e7595dacae917ea8e2a7eb3ad70910bad7b0547a9aa4aef506cf99562fea789766fdb619250440f6fe5cb09ee2217741ec110b2bfdd34dbf5e76deaba5e3137e720c77a4e785a1011c8bd516f4d4e8ecedfb5717288b96c9a79cb4b1817b3b2eae0412d91bc948f839befe0e40df0f068dfd5ab2ab4b2e3ad571ee9b61add141640590bedd624ab187d9ed6aa1a34cb3e181711bf9d9ffd4eb11e5c8bb0f1d887602c3844a01b9ada21c760d458ad93e07d3de8d77add0d29a641e336dcd6f95c9022f0b7b71d1bcf96ac50fd9678c0d32bf02ef7577eef76a06f3866daa44da60ed3472401299b2afc5ccac318a29fd40260aaa7bc2b953e4eac394e9cc12a432c7b5dfb34b3a8d95f3ee5cce9a8a2be58694df2d24fd50943ba81c700a08f935bceabc6cda22d6cb270bea57bbe3157a9e4b19dbfa20a3fb37b54c523d098582808e90e8a791c2f2c921b3108252c5d2d81a321513c89d3e81868a66702c27422502c975bac37739a3a6c799f390acbd8c708ac3a81c9eb689ee2c57cfb3c708161e5010ddb5ecdc2934e6fcaa8b2127c73db7d43d96faff9bde3372d1fbd8453b46bf31faf22fa49038ea8cec78e42d9200ce378ed1666493ae16735134893d09933869672ed7a8db51ebb7545ed6001c5d31b316d8e88e34d3367d0562018a6fa52d4aed9b26911e0cc53a63d8a13fd3fcc856eb576b5afed86724513bc1e8814396d0fdb01dba0836ae04f5e8ef8d7567358655dc9fe848adc5c1d369a63a2d1b5acb9f628731a6ef38ec6fb80062db726463a408f3574d6e5b62cbca35793172d20c5081de3f97bf0920ee800c3829ca9d4f28ab9bd61e3f6724e9c2c401f10b59c9cd222133c43d6b7acfc82b4b733a8f61b5f19f2296766241efdc5d177c3a3dd495298ba257606f598412dc9b831490c8b99686797cd0f5100f9ca02f0f2af1d38343b7bfb05801d311957b7645d413c6684319b549a7d2ffdf2cec285f7c83e1a8222a89c1d8fc4919cbfd09d609c6c1bc0ea211c877404712b7c07105e2c64d4a3bd80e87bfa1f82499e053926d87a3800d043759928bafc4ee3074bf4607009817a1949ff65d8c734eee694641e230a9f7c8a4e40a7fe636ffdd7f529a97b96f627331181d05a2129cd3eef3c7ff6a819a5d4520704c0ca806a465c3a48a169bedde57aae3ee9002941f908e47b9f5c0e0c4d7fb4b2ed82ca43c9a50765978f41322d0f0fc0701c5b84357a2165d8a4b70650fb00a590ae2b074c0d24e2f4b737940efa2c78e1b9bb2692f300c8e3456c12b1debfa22485974d5d6053f9dedc20787e3a7099b9b02eddd55db7d89a99d7a408f4a70c6c6938fec36dc7a6ca31be9f0426ff8e72509512ca3d9b8580d333f8ae643e887821185fa8e76c607938eac3a77056ffb114559d25f5922d160c5899b82638a6390811322394126bd79a73ed6d8c95156f0788e617a6996346dd2a052093ec5ac2d2729b90d2939398d036c992d20938b46a1dae451dba20c7599180f36e0f73b5020b8ad5a844cea751957cf410570d284760e1a71c60b9372624521e4fa7564016772082363c3d3a8b8e2eb7bd46323efb72b2580c8cd6b3eeaa93f